<?xml version="1.0" encoding="UTF-8"?>
<groupmgt xmlns:xsi="http://www.w3.org/2001/XMLSchema-instance" xsi:noNamespaceSchemaLocation="../xsd/group_management.xsd">
	<group type="imsi" name="imsi-4">
		<group-element>
			<key name="imsi" value="93"/>
		</group-element>
	</group>
	<group type="imsi" name="imsi-5">
		<group-element>
			<key name="imsi" value="902"/>
		</group-element>
	</group>
	<group type="imsi" name="TopDataConsumers_010101">
		<group-element>
			<key name="imsi" value="111111"/>
		</group-element>
	</group>
	<group type="imsi" name="TopDataConsumers_010104">
		<group-element>
			<key name="imsi" value="444"/>
		</group-element>
	</group>
</groupmgt>